{
  "schema_version": "1.0",
  "event_type": "agent.incident.v1",
  "incident_id": "inc_01ARZ3NDEKTSV4RRFFQ69G5FAY",
  "revision": 2,
  "idempotency_key": "incident:inc_01ARZ3NDEKTSV4RRFFQ69G5FAY:revision:2",
  "lifecycle": "OPEN",
  "analysis_reason": "CROSS_SOURCE_EVIDENCE_ADDED",
  "opened_at": "2026-08-23T00:00:16.000Z",
  "updated_at": "2026-08-23T00:00:46.000Z",
  "correlation": {
    "state": "CORRELATED",
    "strategy": "DETERMINISTIC_V1",
    "confidence": "HIGH",
    "reason_code": "UNIQUE_ACTIVE_MATCH",
    "matched_on": [
      "ENVIRONMENT",
      "SYMPTOM_FAMILY",
      "AFFECTED_SCOPE",
      "EVENT_TIME"
    ],
    "operator_confirmation_required": false
  },
  "normalized_context": {
    "environment": "dev",
    "symptom_family": "LATENCY",
    "suspected_surfaces": [
      "READ_PATH"
    ],
    "services": [
      "api"
    ],
    "broadcast_ids": [
      "bc_1042"
    ]
  },
  "signals": [
    {
      "schema_version": "1.0",
      "trigger_id": "trg_01ARZ3NDEKTSV4RRFFQ69G5FAW",
      "source": "CHAT_INCIDENT_CANDIDATE",
      "source_schema": "chat.incident_candidate.v1",
      "trigger_type": "USER_SYMPTOM_CLUSTER",
      "idempotency_key": "chat:cand_01ARZ3NDEKTSV4RRFFQ69G5FAV",
      "occurred_at": "2026-08-23T00:00:16.000Z",
      "trace_id": null,
      "evidence": {
        "candidate_id": "cand_01ARZ3NDEKTSV4RRFFQ69G5FAV",
        "candidate_type": "USER_PERCEIVED_LATENCY",
        "broadcast_id": "bc_1042",
        "suspected_surface": "READ_PATH",
        "confidence": "MEDIUM",
        "window_start": "2026-08-23T00:00:00.000Z",
        "window_end": "2026-08-23T00:00:15.000Z",
        "matched_messages": 4,
        "unique_users": 4,
        "strong_signal_count": 3,
        "weak_signal_count": 1,
        "matched_rule_ids": [
          "generic_slow",
          "read_loading_slow"
        ],
        "metric_status": "NOT_CHECKED",
        "root_cause": "UNDETERMINED",
        "requires_metric_corroboration": true
      },
      "guardrails": {
        "analysis_mode": "READ_ONLY",
        "automatic_remediation_allowed": false,
        "must_preserve_uncertainty": true,
        "raw_chat_included": false
      }
    },
    {
      "schema_version": "1.0",
      "trigger_id": "trg_01ARZ3NDEKTSV4RRFFQ69G5FAX",
      "source": "DATADOG_MONITOR",
      "source_schema": "datadog.alert.v1",
      "trigger_type": "MONITOR_ALERT",
      "idempotency_key": "datadog:cycle_example_001:Triggered",
      "occurred_at": "2026-08-23T00:00:46.000Z",
      "trace_id": null,
      "evidence": {
        "event_id": "evt_example_001",
        "cycle_key": "cycle_example_001",
        "monitor_id": "monitor_example",
        "transition": "Triggered",
        "priority": "P2",
        "env": "dev",
        "service": "api",
        "alert_title": "Read latency monitor triggered",
        "alert_body": "Synthetic contract example without production content.",
        "alert_query": "example_metric > example_threshold",
        "host": "",
        "tags": "env:dev,service:api",
        "link": ""
      },
      "guardrails": {
        "analysis_mode": "READ_ONLY",
        "automatic_remediation_allowed": false,
        "must_preserve_uncertainty": true,
        "raw_chat_included": false
      }
    }
  ],
  "guardrails": {
    "analysis_mode": "READ_ONLY",
    "automatic_remediation_allowed": false,
    "must_preserve_uncertainty": true,
    "raw_chat_included": false,
    "single_incident_action_lock_required": true
  }
}
